{
  "schemaVersion": 1,
  "catalogVersion": "1.0.0",
  "status": "published",
  "owner": "Marlandoj",
  "resolutionContract": {
    "version": "1.0.0",
    "hashAlgorithm": "sha256-canonical-json",
    "hashInput": "fully resolved category, detail level, ordered annexes, assumptions, catalog version, maturity, and resolution contract version",
    "hashOutput": "resolved template manifest sha256 and discovery-index entry",
    "baseTemplateCount": 1,
    "mergeOrder": ["category", "detail-level", "annexes-in-declared-order", "user-answers"],
    "arrayPolicy": "append-unique",
    "conflictPolicy": "fail-closed",
    "rules": [
      "Resolve one exact category id@version before applying a detail level.",
      "Apply annexes only in the operator-declared order; every required annex must already be present.",
      "Validate the annex requires graph with depth-first traversal; reject any back-edge as a dependency cycle before resolution.",
      "Reject duplicate, unknown, incompatible, cyclic, floating-version, or hash-drift inputs.",
      "Append unique category, level, and annex decisions, requirements, and verifications; never overwrite earlier entries silently.",
      "User answers may resolve declared decisions and supply repository facts but may not delete source-derived requirements.",
      "Any incompatible assumption or unresolved consequential decision returns HOLD or FAIL rather than a default."
    ]
  },
  "exportContract": {
    "version": "1.0.0",
    "artifactKinds": ["factory-ticket", "swarm-seed"],
    "candidateOnly": true,
    "requiredValidationDecision": "PASS",
    "requiredLineage": ["source path", "source sha256", "build-spec version", "template id", "template version", "template level", "template sha256", "ordered annex ids, versions, and sha256 values"],
    "ticketHeaders": ["Acceptance Criteria", "Target Repo", "Archetype", "Repro"],
    "prohibitedAuthorities": ["create or mutate Linear", "apply factory-ready", "dispatch", "merge", "migrate data", "deploy", "publish", "finalize courseware"],
    "failurePolicy": "Fail closed when deterministic validation, lineage, target repository, archetype, area, or live parser validation is unavailable."
  },
  "assumptionVocabulary": [
    {
      "id": "anonymous-only",
      "description": "The product intentionally has no identity, account, session, role, or resource-ownership model."
    },
    {
      "id": "offline-only",
      "description": "Every required workflow must complete without network access or a remotely hosted dependency."
    },
    {
      "id": "online-required",
      "description": "The primary workflow requires an active network connection and does not promise offline completion."
    }
  ],
  "executionModeDefinitions": {
    "direct": "One bounded builder owns implementation and integration; no parallel workstreams are implied.",
    "swarm": "Multiple dependency-aware workstreams execute under explicit ownership, integration, and approval gates.",
    "undecided": "Execution topology is a blocking human decision; the artifact remains HOLD and cannot be exported for factory execution until resolved."
  },
  "detailLevels": [
    {
      "id": "starter",
      "description": "A bounded, testable first release for one primary user journey.",
      "supportedExecutionModes": ["direct"],
      "requiredSections": ["mission", "capabilities", "constraints", "acceptance", "exclusions"],
      "additionalDecisions": ["What is the smallest usable vertical slice?", "What must explicitly remain out of scope?"],
      "verificationTypes": ["static", "integration", "human"]
    },
    {
      "id": "standard",
      "description": "A product-quality build with persistent state, lifecycle behavior, and operational verification.",
      "supportedExecutionModes": ["direct", "swarm"],
      "requiredSections": ["mission", "users", "workflows", "data", "security", "lifecycle", "quality", "verification", "exclusions"],
      "additionalDecisions": ["Which data and lifecycle contracts are authoritative?", "Which failure and recovery behavior is required?", "What deployment environment is authoritative?"],
      "verificationTypes": ["static", "contract", "integration", "human"]
    },
    {
      "id": "factory",
      "description": "A multi-phase or consequential build with provenance, contracts, ownership, rollout, and evidence gates.",
      "supportedExecutionModes": ["swarm", "undecided"],
      "requiredSections": ["mission", "provenance", "contracts", "requirements", "dag", "ownership", "verification", "scope-policy", "rollout", "rollback", "authority"],
      "additionalDecisions": ["Which repository and branch policy are authoritative?", "Who may approve promotion, merge, migration, deployment, and publication?", "What is the scope-cut order?", "What rollback restores code, data, and external side effects?"],
      "verificationTypes": ["static", "contract", "integration", "performance", "human"]
    }
  ],
  "annexes": [
    {
      "id": "auth",
      "version": "1.0.0",
      "description": "Identity, session, authorization, ownership, and account lifecycle controls.",
      "requires": [],
      "incompatibleAnnexes": [],
      "incompatibleAssumptions": ["anonymous-only"],
      "decisions": ["Which identity provider and session model are authoritative?", "Which roles and resource-ownership rules apply?"],
      "requirements": ["Enforce authorization server-side for every protected resource.", "Define sign-in, sign-out, session expiry, and account recovery behavior."],
      "verifications": ["Exercise allowed and denied role-resource combinations.", "Prove secrets and privileged decisions are absent from the client bundle."]
    },
    {
      "id": "booking",
      "version": "1.0.0",
      "description": "Availability, reservation conflicts, cancellation, and time-zone behavior.",
      "requires": ["auth"],
      "incompatibleAnnexes": [],
      "incompatibleAssumptions": [],
      "decisions": ["What defines canonical availability and conflict resolution?", "Which cancellation and time-zone policies apply?"],
      "requirements": ["Prevent overlapping confirmed reservations.", "Represent availability and booking timestamps with explicit time-zone semantics."],
      "verifications": ["Run concurrent booking conflict scenarios.", "Test daylight-saving and cross-time-zone boundaries."]
    },
    {
      "id": "payments",
      "version": "1.0.0",
      "description": "Payment intent, settlement, refund, webhook, and reconciliation behavior.",
      "requires": ["auth"],
      "incompatibleAnnexes": [],
      "incompatibleAssumptions": ["offline-only"],
      "decisions": ["Which provider, currency, fee, refund, and tax policies apply?", "Which event is authoritative for fulfillment?"],
      "requirements": ["Process payment side effects idempotently.", "Reconcile provider events with local order state and retain failure evidence."],
      "verifications": ["Replay duplicate and out-of-order webhook events.", "Exercise failed, canceled, refunded, and partially completed payments."]
    },
    {
      "id": "media",
      "version": "1.0.0",
      "description": "Upload, storage, transformation, moderation, accessibility, and retention of media.",
      "requires": [],
      "incompatibleAnnexes": [],
      "incompatibleAssumptions": [],
      "decisions": ["Which formats, size limits, storage provider, and retention rules apply?", "Which moderation and alt-text requirements apply?"],
      "requirements": ["Validate media type and size server-side before durable storage.", "Provide accessible alternatives and deterministic failure states."],
      "verifications": ["Exercise valid, oversized, malformed, and unsupported uploads.", "Verify transformed assets retain ownership and accessibility metadata."]
    },
    {
      "id": "offline",
      "version": "1.0.0",
      "description": "Offline operation, local persistence, synchronization, and conflict handling.",
      "requires": [],
      "incompatibleAnnexes": [],
      "incompatibleAssumptions": ["online-required"],
      "decisions": ["Which workflows must work offline?", "Which conflict-resolution and data-loss policies apply?"],
      "requirements": ["Retain committed offline work across restart.", "Surface synchronization conflicts without silently discarding user data."],
      "verifications": ["Run create-edit-delete flows without network connectivity.", "Reconnect with conflicting server and client changes."]
    },
    {
      "id": "realtime",
      "version": "1.0.0",
      "description": "Live state propagation, presence, ordering, reconnect, and stale-state handling.",
      "requires": ["auth"],
      "incompatibleAnnexes": [],
      "incompatibleAssumptions": ["offline-only"],
      "decisions": ["Which events require realtime delivery and ordering?", "What reconnect and stale-state policy applies?"],
      "requirements": ["Preserve event ordering and authorization across reconnects.", "Expose stale or disconnected state to the user."],
      "verifications": ["Exercise reconnect, duplicate, reordered, and unauthorized events.", "Measure propagation latency against the declared budget."]
    },
    {
      "id": "ai-evaluation",
      "version": "1.0.0",
      "description": "Model contracts, evaluation sets, fallbacks, uncertainty, and human escalation.",
      "requires": [],
      "incompatibleAnnexes": [],
      "incompatibleAssumptions": [],
      "decisions": ["Which model capability and provider contracts are required?", "Which evaluation thresholds and escalation conditions govern release?"],
      "requirements": ["Evaluate production-equivalent model and retrieval paths on versioned fixtures.", "Expose uncertainty and route defined failures without fabricating success."],